Judul,Tanggal,Artikel,Category
"25 Contoh Soal TKP SKD CPNS 2023 Part 1 beserta Jawaban, Ayo Latihan!","Kamis, 02 Nov 2023 10:30 WIB","Pada 9-18 November 2023, peserta CPNS yang lolos seleksi administrasi akan mengikuti ujian Seleksi Kompetensi Dasar (SKD). Dalam ujian SKD, terdapat tiga jenis soal yakni Tes Wawasan Kebangsaan (TWK), Tes Intelegensi Umum (TIU), dan Tes Karakteristik Pribadi (TKP). Berbeda dengan dua jenis tes lainnya, soal TKP memiliki pembobotan tersendiri. Jumlah soal TKP SKD CPNS terdiri dari 45 soal. Masing-masing soal memuat pertanyaan yang dapat menilai kemampuan peserta CPNS terkait pelayanan publik, jejaring kerja, sosial budaya, profesionalisme, dan lainnya. SCROLL TO CONTINUE WITH CONTENT Mengutip E-Book Soal-Soal HOTS Tes CPNS terbitan Pustaka Baru Press, berikut beberapa contoh soal TKP SKD CPNS 2023 beserta kunci jawaban: 1. Jika saya diterima menjadi PNS dan saya tak mempunyai uang maka saya... A. Mengundurkan diri sesegera mungkinB. Mencari bantuan atasanC. Melakukan kerja apapun asal bisa mendapat uangD. Mencari pinjaman ke teman lainnyaE. Mencari sumbangan dari suatu lembaga Skor A=1, B=2, C=5, D=3, E=4 2. Anda adalah seorang karyawan dari sebuah perusahaan ritel. Anda me mahami bahwa perusahaan Anda memiliki potensi untuk ikut serta dalam perdagangan Internasional. Apa sikap Anda terhadap kondisi tersebut? A. Mengusulkan pada pimpinan mengenai potensi tersebut agar dapat mengoptimalkan per dagangan.B. Tidak memberikan usulan pada atasan karena bukan wewenang saya.C. Saya tanyakan terlebih dahulu kepada rekan-rekan mengenai hal tersebut.D. Saya masih merasa kurang yakin terhadap potensi perusahaan.E. Membiarkan saja, sampai ada rekan lain yang mengusulkan. Skor A=5, B=2, C=4, D=3, E=1 3. Jika Anda menghadapi tugas yang berat dan menuntut kemampuan tinggi, sikap Anda... A. Menyuruh orang lain untuk menyelesaikan tugas tersebutB. Berusaha sedikit demi sedikit untuk menyelesaikannya walaupun memakan banyak waktuC. Meminta bantuan teman untuk menyelesaikannyaD. Mencari solusi yang tidak membutuhkan banyak waktuE. Meninggalkan tugas begitu saja sambil mencari alasan untuk atasan Skor A=2, B=5, C=3, D=4, E=1 4. Ketua panitia kegiatan harus membuat laporan pertanggunggjawaban pada atasan. Jika Anda bertugas sebagai ketua, maka ... A. Menyerahkan tugas pembuatan laporan pada anak buah.B. Saya dan rekan panitia lain bersama-sama menyusun laporan.C. Membuat laporan secara individu agar tidak terjadi kesalahan.D. Meminta sekretaris membuat lapor an tersebut.E. Membentuk tim khusus untuk membuat laporan dengan saya sebagai koordinator. Skor A=2, B=5, C=1, D=3, E=4 5. Saya berhasil mengatasi tantangan karena ... A. Nasib baik selalu ada di tangan sayaB. Saya berani mencoba dengan segala risikonyaC. Selalu berada di zona nyaman sayaD. Selalu mendapat bantuan dari teman dan lingkungan sayaE. Saya tidak pernah berputus asa Skor A=1, B=4, C=3, D=2, E=5 6. Seberapa sering Anda menuliskan rencana Anda secara spesifik dan ada batas waktunya? A. Saya selalu mencatat rencana saya secara detail agar pencapaiannya optimalB. Saya tidak pernah membuat perencanaan secara detail karena spontanitas adalah sifat sayaC. Saat saya membutuhkan untuk berpikir ulang, saya akan mengatur kembali pekerjaan sayaD. Saya jarang menuliskan rencana saya secara detail karena sudah terekam dalam pikiran sayaE. Saya hanya menuliskan sasaran saya secara umum Skor A=5, B=1, C=3, D=2, E=4 7. Saya sedang mengerjakan laporan tugas semester yang akan dikumpulkan besok pagi. Tiba-tiba sahabat saya datang dengan wajah sedih dan ingin curhat pada saya. Sikap saya adalah ... A. Pura-pura mendengarkan ceritanya dan fokus pada pekerjaan sayaB. Memberikan tanggapan yang wajar sambil tetap mengerjakan laporan sayaC. Meneruskan mengerjakan laporan tanpa mempedulikan teman sayaD. Menanggapi dan memberi berbagai alternatif solusiE. Dengan menyesal menolak mende ngarkan keluhannya Skor A=2, B=5, C=3, D=1, E=4 8. Dalam suatu tugas kelompok, Anda merasa sudah mengerjakan tugas Anda dengan baik, namun teman-teman Anda merasa Anda belum optimal dalam bekerja. Sikap Anda kemudian A. MenyangkalnyaB. Menerima dengan lapang dada dan memperbaiki kinerja sayaC. Balas memarahi teman Anda karena bukan pekerjaan Anda saja yang kurang optimalD. Bersedih hatiE. Menerima dengan berat hati daripada memperpanjang masalah Skor A=2, B=5, C=1, D=3, E=4 9. Ketika proyek yang Anda lakukan mengalami kegagalan karena salah satu anggota tim Anda, maka... A. Saya merasa tidak ikut bertanggung jawab karena saya sudah bekerja sekuat tenagaB. Saya tidak bisa dipersalahkan karena bukan sepenuhnya kesalahan sayaC. Anggota tersebut harus bertanggung jawab sepenuhnya atas apa yang sudah dilakukannyaD. Ikut bertanggung jawab sesuai dengan jobdesk saya saja karena saya adalah bagian dari tim pelaksana proyek tersebutE. Menerima konsekwensi atas kegagalan tersebut dan mengevaluasinya bersama tim Skor A=1, B=2, C=3, D=4, E=5 10. Jika Anda diminta mengerjakan tugas yang tidak sesuai dengan bidang pekerjaan Anda oleh atasan, apa yang akan Anda lakukan? A. Tetap menerima tugas tersebut karena perintah atasanB. Menolak secara baik-baik karena tidak sesuai dengan jobdesk sayaC. Menolak dengan tegas agar atasan tidak semena-mena di masa mendatangD. Tetap menerima tugas tersebut agar disukai atasanE. Meminta rekan lain mengerjakan tugas tersebut Skor A=3, B=5, C=4, D=2, E=1 11. Respons saya ketika ditugaskan oleh pimpinan untuk menjadi notulen dalam rapat Badan Pertimbangan Jabatan dan Kepangkatan adalah... A. Tidak akan membocorkan hasil keputusan karena bukan wewenang sayaB. Memberitahukan kepada anggota keluarga mengenai hasil keputusan rapatC. Menghindari rekan yang membujuk untuk mengetahui hasil rapatD. Saya akan menceritakan pada semua rekan saya hasil keputusan rapat jika mendapatkan imbalanE. Memberitahu sahabat saya di kantor tentang hasil rapat Skor A=5, B=3, C=4, D=1, E=2 12. Dalam memberikan suatu gagasan, saya dikenal sebagai orang yang... A. Penyempurna sistem yang adaB. Penuh ide baruC. Memiliki gagasan rasionalD. Memberikan solusi terbaikE. Menempuh banyak risiko Skor A=5, B=2, C=3, D=4, E=1 13. Saya ingin meminta izin pada atasan karena ada urusan yang sangat mendesak, namun atasan saya sedang berbicara dengan rekan kerja yang lain. Saya akan... A. Langsung pulang dan meninggalkan pesan kepada rekan kerja yang lain untuk menyampaikannya pada atasan B. Menunggu pembicaraan mereka berakhirC. Menyela pembicaraan mereka setelah minta maaf sebelumnyaD. Langsung masuk ke ruangan dan mengutarakan maksud sayaE. Mendengarkan dan menimbang penting tidaknya pembicaraan mereka sebelum menyela untuk meminta izin Skor A=2, B=3, C=4, D=1, E=5 14. Saat dalam perjalanan menuju kantor, motor Anda tiba-tiba bannya bocor, padahal pagi itu Anda harus memimpin rapat divisi. Di dekat Anda ada pangkalan becak. Bagaimana sikap Anda? A. Marah pada keadaanB. Segera memilih untuk naik becak ke kantorC. Menelepon teman sekerja untuk menjemputD. Menelepon atasan dan meminta untuk membatalkan rapatE. Menunggu bus atau kendaraan lain yang mungkin akan segera lewat Skor A=1, B=5, C=4, D=2, E=3 15. Setelah bersusah payah, akhirnya divisi saya dapat menjuarai kompetisi yang diadakan oleh kantor saya tahun ini. Untuk mempertahankan prestasi yang akan dilakukan oleh divisi saya adalah... A. Mempelajari kelemahan tim lawan untuk dapat mengalahkan mereka di kompetisi selanjutnyaB. Berlatih secara rutin dan terprogramC. Menambah latihan fisik dan analisis mendalam terhadap tim lawanD. Melakukan pertandingan uji coba untuk meningkatkan kemampuanE. Mempelajari teknik-teknik baru sebagai persiapan kompetisi selanjut nya Skor A=3, B=4, C=5, D=2, E=1 16. Menurut Anda, seseorang akan kehilangan kesempatan mengembangkan usahanya lebih disebabkan karena... A. Menunda-nunda waktu pengerjaannyaB. Takut akan risikonyaC. Tidak fokus pada usahanyaD. Bertahan pada cara yang lamaE. Menunggu bantuan pihak lain Skor A=4, B=3, C=5, D=2, E=1 17. Ketika saya menjelaskan sesuatu hal kepada orang lain, hal yang terjadi adalah... A. Orang memahami penjelasan saya dengan baikB. Orang menjadi antusias dengan penjelasan sayaC. Kebanyakan orang meminta agar penjelasan tersebut diulangD. Sebagian orang masih meminta penjelasan kepada sayaE. Tidak ada yang memberikan tanggapan atas penjelasan saya Skor A=4, B=5, C=2, D=3, E=1 18. Pada saat saya sedang mengerjakan suatu tugas kerja, saya akan ... A. Sesekali menyelanya dengan kegiatan lain sebagai hiburanB. Melakukan pekerjaan lain secara bersamaanC. Menundanya dan melihat apakah ada tugas lain yang harus diselesaikanD. Hanya melakukan satu pekerjaan dalam satu waktuE. Melakukan pekerjaan lain yang tidak berhubungan dengan pekerjaan Skor A=1, B=5, C=5, D=4, E=4 19. Jika bawahan saya melakukan tugasnya dengan baik, maka saya ... A. Puas, namun tidak perlu memuji karena hal itu akan membuatnya sombongB. Tidak akan memujiC. Memuji secukupnyaD. Menyanjungnya agar dia senang dan bersemangatE. Menunggu dia berhasil melakukan tugas yang lain baru memujinya Skor A=3, B=1, C=5, D=4, E=2 20. Orang-orang di sekitar saya, mengenal saya sebagai pribadi yang ... A. PeriangB. RajinC. SupelD. Pantang menyerahE. Visioner Skor A=1, B=2, C=3, D=5, E=4 21. Pada saat Anda diserahi suatu tugas dengan keterbatasan sumber daya, maka Anda akan... A. Mencari bantuan dari orang lain untuk mendapatkan bahan yang diperlukanB. Menggunakan bahan yang ada sajaC. Mencari sendiri bahan-bahan yang dibutuhkan sebatas kemampuan sayaD. Mencari bahan yang dibutuhkan dengan cara apapunE. Menunggu teman lain berinisiatif untuk memberikan bahan yang dibutuhkan Skor A=3, B=2, C=4, D=5, E=1 22. Pada saat harus memecahkan suatu persoalan, maka biasanya pikiran saya... A. Mudah beralih jika benar-benar terganggu dan berpindah pada tugas lainnyaB. Fokus pada tugas tersebut apapun gangguannya sampai mendapat solusinyaC. Mudah teralihkan pada hal lain jika ada gangguan sedikit sajaD. Masih tetap fokus jika yang muncul hanya gangguan kecil sajaE. Mudah menyerah jika tidak segera mendapatkan solusinya Skor A=1, B=2, C=5, D=3, E=4 23. Dalam pertandingan di sekolah, tim saya nampak loyo dan tidak bersemangat, sehingga dipastikan akan kalah, sikap saya... A. Memberi dukungan seperti temanteman yang lainnyaB. Diam saja dan mengamati situasi yang terjadiC. Tetap semangat memberi dukungan tanpa dimintaD. Meninggalkan pertandingan meski pun belum selesaiE. Berusaha menutup-nutupi jika saya adalah anggota tim tersebut Skor A=1, B=2, C=5, D=3, E=4 24. Saya ingin rekan-rekan saya melihat kualitas diri saya yang... A. Disiplin dan penurutB. Kreatif dan inovatifC. Mampu beradaptasi dan ramahD. Dapat memutuskan sendiri dan realistisE. Percaya diri dan mandiri Skor A=1, B=5, C=2, D=3, E=4 25. Ketika teman sekelas saya membicarakan salah satu teman yang bermasalah, sikap saya... A. Mengajak teman-teman yang lain untuk mempertimbangkan suatu tindakan tertentuB. Mengajukan usulan alternatif tindakan yang tepatC. Meyakinkan teman-teman yang lain untuk melakukan suatu tindakanD. Menyetujui apa saja yang menjadi keputusan bersamaE. Membicarakan dengan teman terdekat saya apa yang bisa menjadi kemungkinan terbaik Skor A=5, B=4, C=3, D=1, E=2 Itulah contoh soal TKP SKD CPNS 2023. Semoga bermanfaat dan selamat berlatih! ",Edu
"Aturan Larang Dosen 'Killer', Warek UGM: Intinya Kampanye Relasi Antikekerasan","Kamis, 02 Nov 2023 10:00 WIB","Universitas Gadjah Mada (UGM) sedang menyusun aturan yang melarang dosen 'killer'. Intinya, mengkampanyekan relasi antikekerasan di kampus. Berikut wawancara lengkap detikEdu dengan Wakil Rektor Bidang Pendidikan dan Pengajaran UGM Prof Wening Udasmoro terkait kebijakan larangan dosen 'killer' ini dan atas dasar riset apa yang membuat kebijakan ini dikeluarkan. Apakah benar Direktorat Pendidikan dan Pengajaran akan membuat Standart Operasional Prosedur (SOP) yang mengatur tentang dosen killer'? Jika iya, akan seperti apa format SOP-nya? Apakah mengatur prosedur pengajaran dosen atau akan lebih mengatur cara dosen memberi tugas atau bagaimana? SCROLL TO CONTINUE WITH CONTENT Iya, jadi begini. Itukan kebijakan dari rektorat. Sebetulnya tidak merujuk pada 'killer', kata dosen 'killer' ini kan mungkin karena itu terminologi yang umum. Tapi intinya, SOP ini untuk mengkampanyekan relasi tanpa kekerasan di UGM. Itu nanti mengatur dari berbagai macam lini. Tidak hanya relasi dosen dengan mahasiswa, tapi juga dosen dengan tendik (tenaga pendidik). Lalu dosen dengan dosen, karena bisa ada exercise of power, dan lain sebagainya. Relasi ini akan menjadi kampanye besar-besaran karena juga kami masukkan ke kurikulum MOOC (Massive Open Online Course). Jadi ada perkuliahan-perkuliahan yang hubungannya tentang kita menentang segala bentuk kekerasan. Sebetulnya, ini juga tentang health ya, physical health, mental health, dan juga social health. Jadi itu nanti akan sangat komprehensif. Dari pendidikan hingga pengajarannya. Dulu kan kalo kita sekolah, istilahnya di-thuthuk. Kalo gak sesuai dengan arahan, dikerasin sama guru. Dan itu di banyak sekolah masih sering terjadi. Nah, di perguruan tinggi bentuknya mulai mereproduksi kekerasan verbal, kekerasan psikologis. Beban mahasiswa sekarang kan berat ya, tidak hanya tekanan pendidikan tetapi juga insecurity dan takut salah, kita coba kurangi bebannya dengan mengurangi tekanan terkait kekerasan. Yang mana hal ini akan kita lakukan secara bersama-sama akan membuat dari berbagai lini relasi yang ekual dan saling menghormati ada empati dan solidaritas. Bagaimana latar belakang awal dalam memutuskan untuk membuat SOP ini? Apakah dorongan/inisiatif dari dosen-dosen, fakultas, atau mahasiswa? Oh ini sangat kompleks. Tidak hanya dari satu sebab, ada multikausaliti. Di dalam renstra (rencana strategis) Bu Rektor (Prof dr Ova Emilia, M Med Ed, SpOG(K), PhD-red) 2022-2027, itu ada satu poin membangun perguruan tinggi yang aman, nyaman, ramah, inklusif, dan bertanggung jawab secara sosial. Melalui pilar ini, kita melihat perlunya membahas persoalan kesehatan mahasiswa. Selain itu, kita juga punya pengalaman-pengalaman empiris di mahasiswa yang mana kita coba rangkai sebagai policy dan habitusnya. Paling penting adalah ekosistemnya ini. Dalam penyusunan SOP ini, apakah ada basis riset yang dilakukan? Jika ada, bagaimana proses pendalaman kajiannya? Berapa lama riset yang dilakukan? Dan oleh siapa disusunnya? Yaa ini kan sebuah mekanisme. Kami punya 3 poin dalam mekanisme ini. Pertama kuratif, kedua preventif, dan yang ketiga promotif. Kami memiliki klinik GMC (Gama Medical Center), UKP (Unit Konsultasi Psikologi) dari Fakultas Psikologi, lalu ada RSA (Rumah Sakit Akademik) untuk konseling Psikiatri. Terus kemudian kita punya beberapa pencagahan tindakan preventif melalui screening kesehatan mental mahasiswa. Ada workshop, poster, peer group dan lainnya. Nah yang SOP ini adalah mekanisme preventif. Misalnya, peran DPA bagaimana, peran dosen pembimbing skripsi akan seperti apa, harus bagaimana, ini sedang proses karena ini sistem baru. Kita dibantu fakultas psikologi yang memiliki riset-riset di bidang tersebut. Kamudian dari Health Promoting University (HPU), ini unit pencegahan. Nanti yang membuat ini dari mereka-mereka yang punya keilmuannya. Dan dibantu keterlibatan semua fakultas, mahasiswa, dan dosen. Kalau riset-riset tentang ini sudah dilakukan sejak lama, it's not a new thing. Saya kira, teman-teman psikologi sudah melakukan banyak di bidangnya pastinya. Cuman, ini kan policy, kebijakan dari renstra UGM. Dari renstra UGM kita ingin menjadikan mahasiswa UGM yang kuat dan tangguh, baik secara fisik, intelektual, dan mental. Kapan SOP ini akan diresmikan? Nanti kami beritahu ya. Soalnya untuk membuat policy ini kan ada public hearingnya, kita perlu berbagai masukan. Karena jangan sampai poin-poinnya dianggap subjektif, tidak relevan dan akurat dengan kebutuhan. Karena saya rasa ini menjadi sesuatu yang baru. Untuk mengkampanyekan lanjutan, akan dilakukan bagaimana? Apakah oleh HPU? Jadi, HPU ini kan bekerjanya di bawah renstra rektor. Renstra ini yang menjadi acuan bagi unit-unit di bawahnya. Kita saat ini kan fokusnya ke Sustainabiliy Development, jadi saya anggap hal (menciptakan lingkungan kampus sehat) menjadi penting. Dan promosinya dilakukan oleh semua, HPU termasuk, juga fakultas dan unit-unit klinikbergerak bersama. Karena dengan bergerak bersama, awareness-nya akan lebih mudah dicapai. Apakah akan ada tahap evaluasi setelah SOP jadi? Dan siapa yang akan mengevaluasi? Tentu saja, semua policy akan dibaca dan dilaksanakan. Akan ada trial and error. Seperti contoh, peraturan mengenai kekerasan seksual yang pertama kali membuat kan UGM. Baru satu tahun kemudian Kementerian (Kemendikbud) yang bikin. Lalu, setelah itu kita juga merespons peraturan menteri dengan melakukan revisi-revisi peraturan tersebut. Jadi, semua policy akan diterapkan dan disesuaikan lagi dalam praktiknya. Istilahnya, UGM ingin menginspirasi banyak orang agar pendidikan itu memang seharusnya nonviolent. Dari bentuk apapun, violance bentu psikologis, psikis, psikologi, simbolik hingga kekerasan seksual. Harusnya kita terhindar dari itu, karena kita institusi pendidikan. ",Edu
Mendikbudristek Dampingi Presiden Resmikan Pembangunan-Revitalisasi Sekolah di IKN,"Kamis, 02 Nov 2023 09:30 WIB","Menteri Pendidikan, Kebudayaan, Riset, dan Teknologi (Mendikbudristek), Nadiem Anwar Makarim, mendampingi Presiden Joko Widodo meresmikan pembangunan dan revitalisasi sekolah di Ibu Kota Nusantara (IKN), Kalimantan Timur, Rabu (1/11/2023) kemarin). Diketahui sekolah yang akan dibangun bernama Nusantara Intercultural School (NIS). Hal ini disebut sebagai bukti keseriusan pemerintah dalam menyediakan pendidikan bermutu bagi masyarakat dan Aparatur Sipil Negara (ASN) yang akan pindah ke IKN. Tak hanya itu, lima sekolah dasar (SD) yang juga ada di IKN dan sekitarnya ikut terkena dampak baik revitalisasi. Salah satunya adalah SD Negeri 020 Sepaku yang ada tepat di IKN. SCROLL TO CONTINUE WITH CONTENT ""Saya senang ini akan memperbaiki kualitas pendidikan tidak hanya di SD Negeri 020 Sepaku, tetapi kita juga sedang memperbaiki lima Sekolah Dasar (SD) yang lain di sekitar Ibu Kota Nusantara,"" ujar Jokowi dalam keterangan tertulis, dikutip Kamis (2/11/2023). Revitalisasi pada SD Negeri 020 Sepaku adalah langkah yang harus dilakukan pemerintah. Karena sekolah tersebut berada di lokasi yang rawan banjir sehingga proses belajar-mengajar kerap terganggu. Bekerjasama dengan banyak pihak, sekolah akan dibangun di lokasi yang lebih aman dan nyaman serta dengan peningkatan sarana dan prasarana mumpuni. Mas Menteri Nadiem juga mengapresiasi kolaborasi banyak pihak yang tergabung dalam membangun sekolah di IKN. Hal ini menurutnya sebagai bukti bila pembangunan yang tengah digerakan untuk IKN tak hanya infrastruktur. Namun, juga proses untuk meningkatkan mutu Sumber Daya Manusia (SDM) masa depan. Ia berharap, di masa mendatang sekolah di IKN dapat memerdekakan pelajar dan Kurikulum Merdeka juga bisa diterapkan di satuan pendidikan di IKN. Terlebih kini, Kurikulum Merdeka sudah diterapkan oleh 300.000 satuan pendidikan di seluruh Indonesia dan amanat dari Presiden Joko Widodo. ""Dengan Kurikulum Merdeka, materi dipangkas hampir 30-40 persen, sehingga sekarang yang terpenting adalah kedalaman analisa dan kemampuan berpikir kritis,"" jelas Nadiem. Tak hanya siswa, Nadiem juga mengajak guru dan tenaga kependidikan untuk memanfaatkan transformasi dan reformasi pengelolaan pendidikan melalui Platform Merdeka Belajar (PMM). Saat ini, PMM sudah digunakan oleh lebih dari 2,8 juta guru di seluruh Indonesia untuk saling berbagi. Terakhir, Mendikbudristek juga berharap Asesmen Nasional (AN) ikut dimanfaatkan sebagai acuan bagi kepala sekolah untuk membantu tata kelola satuan pendidikan. Untuk itu, Nadiem mengajak seluruh pemangku kepentingan untuk bekerja sama menciptakan ekosistem pendidikan yang bermutu. Terutama mementingkan pada perkembangan peserta didik melalui Merdeka Belajar. ""Mari terus menguatkan gotong royong kita untuk menciptakan lingkungan belajar yang aman dan nyaman, untuk mewujudkan Merdeka Belajar di Ibu Kota Nusantara,"" tutup Nadiem. Menjadi sekolah yang akan direvitalisasi, Kepala Sekolah SDN 020 Sepaku, Pujianto merespon positif hal ini. Ia senang karena memang kondisi sekolahnya sudah tidak layak. ""Senang sekali, karena kondisi sekolah kami yang tidak layak, alhamdulillah kami bisa dapat sekolah yang (akan dibangun) luar biasa bagusnya,"" ujarnya. Tak hanya itu, salah satu siswa kelas satu SDN 020 Sepaku, Fanaya Ashalina mengaku senang akan punya sekolah baru. Ia berharap sekolahnya nanti tak lagi banji seperti saat ini. ""Rasanya senang dan bangga bisa punya sekolah baru. Semoga enggak banjir lagi, jadi bisa sekolah dengan nyaman,"" seru Fanaya. Dilaksanakan dalam acara Groundbreaking Revitalisasi SD Negeri 020 Sepaku, Kalimantan Timur, Presiden meletakkan batu pertama di dua tempat sekolah secara simbolis dengan menekan tombol sirine. Pada proses tersebut, Presiden didampingi Mendikbudristek, Mensesneg, Menteri PUPR, Menteri BUMN, Kepala Otorita IKN, Pj. Gubernur Kalimantan Timur, Pj Bupati Penajam Paser Utara, pimpinan Jakarta Intercultural School, Direktur Astra, serta pimpinan Yayasan Pendidikan Astra. ",Edu
